{
  "$schema": "http://json-schema.org/draft-07/schema#",
  "title": "主治医意見書フォーマット Ver.1.3",
  "description": "項番14-123の全110項目",
  "type": "object",
  "properties": {
    "basic_info": {
      "type": "object",
      "description": "基本情報（項番14-32）",
      "properties": {
        "date_of_writing": { "type": "string", "description": "記入日 YYYYMMDD（項番14）" },
        "patient_name_kana": { "type": "string", "description": "患者名かな（項番15）" },
        "patient_name": { "type": "string", "description": "患者名（項番16）" },
        "birth_date": { "type": "string", "description": "生年月日 YYYYMMDD（項番17）" },
        "age": { "type": "string", "description": "患者・年齢（項番18）" },
        "sex": { "type": "string", "description": "性別 0:未選択,1:男,2:女（項番19）" },
        "postal_code": { "type": "string", "description": "郵便番号（項番20）" },
        "address": { "type": "string", "description": "住所（項番21）" },
        "phone": { "type": "string", "description": "連絡先電話番号（項番22）" },
        "physician_name": { "type": "string", "description": "医師氏名（項番23）" },
        "institution_name": { "type": "string", "description": "医療機関名（項番24）" },
        "institution_postal_code": { "type": "string", "description": "医療機関郵便番号（項番25）" },
        "institution_address": { "type": "string", "description": "医療機関所在地（項番26）" },
        "institution_phone": { "type": "string", "description": "医療機関電話番号（項番27）" },
        "institution_fax": { "type": "string", "description": "医療機関FAX番号（項番28）" },
        "consent": { "type": "string", "description": "同意の有無 0:未選択,1:同意する,2:同意しない（項番29）" },
        "last_examination_date": { "type": "string", "description": "最終診察日 YYYYMMDD（項番30）" },
        "opinion_count": { "type": "string", "description": "意見書作成回数 0:未選択,1:初回,2:2回目以上（項番31）" },
        "other_department_visit": { "type": "string", "description": "他科受診有無 0:未選択,1:有,2:無（項番32）" }
      }
    },
    "diagnosis": {
      "type": "object",
      "description": "傷病に関する意見（項番33-43）",
      "properties": {
        "other_departments": { "type": "string", "description": "他科名 13桁のビットフラグ（項番33）" },
        "other_department_names": { "type": "string", "description": "その他の他科名（項番34）" },
        "diagnosis_1_name": { "type": "string", "description": "診断名1（項番35）" },
        "diagnosis_1_onset": { "type": "string", "description": "発症年月日1（項番36）" },
        "diagnosis_2_name": { "type": "string", "description": "診断名2（項番37）" },
        "diagnosis_2_onset": { "type": "string", "description": "発症年月日2（項番38）" },
        "diagnosis_3_name": { "type": "string", "description": "診断名3（項番39）" },
        "diagnosis_3_onset": { "type": "string", "description": "発症年月日3（項番40）" },
        "symptom_stability": { "type": "string", "description": "症状安定性 0:未選択,1:安定,2:不安定,3:その他（項番41）" },
        "symptom_unstable_details": { "type": "string", "description": "症状不安定時の具体的状況（項番42）" },
        "course_and_treatment": { "type": "string", "description": "経過及び治療内容 560文字/12行以内（項番43）" }
      }
    },
    "special_medical_care": {
      "type": "object",
      "description": "特別な医療（項番44-46）",
      "properties": {
        "treatments": { "type": "string", "description": "処置内容 9桁のビットフラグ（項番44）" },
        "special_responses": { "type": "string", "description": "特別な対応 2桁のビットフラグ（項番45）" },
        "incontinence_care": { "type": "string", "description": "失禁への対応 0:未選択,1:選択（項番46）" }
      }
    },
    "mental_physical_state": {
      "type": "object",
      "description": "心身の状態に関する意見（項番47-95）",
      "properties": {
        "bedridden_level": { "type": "string", "description": "寝たきり度 1-9（項番47）" },
        "dementia_level": { "type": "string", "description": "認知症高齢者の日常生活自立度 1-8（項番48）" },
        "short_term_memory": { "type": "string", "description": "短期記憶 0:未選択,1:問題なし,2:問題あり（項番49）" },
        "cognitive_ability": { "type": "string", "description": "認知能力 1-4（項番50）" },
        "communication_ability": { "type": "string", "description": "伝達能力 1-4（項番51）" },
        "peripheral_symptoms": { "type": "string", "description": "周辺症状有無 0:未選択,1:有,2:無（項番52）" },
        "peripheral_symptoms_details": { "type": "string", "description": "周辺症状詳細 12桁のビットフラグ（項番53）" },
        "other_peripheral_symptoms": { "type": "string", "description": "その他の周辺症状（項番54）" },
        "psychiatric_symptoms": { "type": "string", "description": "精神神経症状有無 0:未選択,1:有,2:無（項番55）" },
        "psychiatric_symptom_name": { "type": "string", "description": "精神神経症状名（項番56）" },
        "specialist_visit": { "type": "string", "description": "専門医受診有無 0:未選択,1:有,2:無（項番57）" },
        "specialist_department": { "type": "string", "description": "専門医受診科名（項番58）" },
        "dominant_hand": { "type": "string", "description": "利き腕 0:未選択,1:右,2:左（項番59）" },
        "height": { "type": "string", "description": "身長（項番60）" },
        "weight": { "type": "string", "description": "体重（項番61）" },
        "weight_change": { "type": "string", "description": "体重の変化 0:未選択,1:増加,2:維持,3:減少（項番62）" },
        "limb_loss": { "type": "string", "description": "四肢欠損 0:未選択,1:選択（項番63）" },
        "limb_loss_location": { "type": "string", "description": "四肢欠損部位（項番64）" },
        "paralysis": { "type": "string", "description": "麻痺 0:未選択,1:選択（項番65）" },
        "paralysis_right_upper_limb": { "type": "string", "description": "麻痺右上肢 0:未選択,1:選択（項番66）" },
        "paralysis_right_upper_limb_severity": { "type": "string", "description": "麻痺右上肢程度 0:未選択,1:軽,2:中,3:重（項番67）" },
        "paralysis_left_upper_limb": { "type": "string", "description": "麻痺左上肢 0:未選択,1:選択（項番68）" },
        "paralysis_left_upper_limb_severity": { "type": "string", "description": "麻痺左上肢程度 0:未選択,1:軽,2:中,3:重（項番69）" },
        "paralysis_right_lower_limb": { "type": "string", "description": "麻痺右下肢 0:未選択,1:選択（項番70）" },
        "paralysis_right_lower_limb_severity": { "type": "string", "description": "麻痺右下肢程度 0:未選択,1:軽,2:中,3:重（項番71）" },
        "paralysis_left_lower_limb": { "type": "string", "description": "麻痺左下肢 0:未選択,1:選択（項番72）" },
        "paralysis_left_lower_limb_severity": { "type": "string", "description": "麻痺左下肢程度 0:未選択,1:軽,2:中,3:重（項番73）" },
        "paralysis_other": { "type": "string", "description": "麻痺その他 0:未選択,1:選択（項番74）" },
        "paralysis_other_location": { "type": "string", "description": "麻痺その他部位（項番75）" },
        "paralysis_other_severity": { "type": "string", "description": "麻痺その他程度 0:未選択,1:軽,2:中,3:重（項番76）" },
        "muscle_weakness": { "type": "string", "description": "筋力低下 0:未選択,1:選択（項番77）" },
        "muscle_weakness_location": { "type": "string", "description": "筋力低下部位（項番78）" },
        "muscle_weakness_severity": { "type": "string", "description": "筋力低下程度 0:未選択,1:軽,2:中,3:重（項番79）" },
        "joint_contracture": { "type": "string", "description": "関節拘縮 0:未選択,1:選択（項番80）" },
        "joint_contracture_location": { "type": "string", "description": "関節拘縮部位（項番81）" },
        "joint_contracture_severity": { "type": "string", "description": "関節拘縮程度 0:未選択,1:軽,2:中,3:重（項番82）" },
        "joint_pain": { "type": "string", "description": "関節痛み 0:未選択,1:選択（項番83）" },
        "joint_pain_location": { "type": "string", "description": "関節痛み部位（項番84）" },
        "joint_pain_severity": { "type": "string", "description": "関節痛み程度 0:未選択,1:軽,2:中,3:重（項番85）" },
        "ataxia_involuntary_movement": { "type": "string", "description": "失調不随意運動 0:未選択,1:選択（項番86）" },
        "ataxia_upper_limbs": { "type": "string", "description": "失調不随意運動上肢 2桁のビットフラグ（項番87）" },
        "ataxia_lower_limbs": { "type": "string", "description": "失調不随意運動下肢 2桁のビットフラグ（項番88）" },
        "trunk": { "type": "string", "description": "体幹 2桁のビットフラグ（項番89）" },
        "pressure_ulcer": { "type": "string", "description": "褥瘡 0:未選択,1:選択（項番90）" },
        "pressure_ulcer_location": { "type": "string", "description": "褥瘡部位（項番91）" },
        "pressure_ulcer_severity": { "type": "string", "description": "褥瘡程度 0:未選択,1:軽,2:中,3:重（項番92）" },
        "other_skin_disease": { "type": "string", "description": "その他皮膚疾患 0:未選択,1:選択（項番93）" },
        "other_skin_disease_location": { "type": "string", "description": "その他皮膚疾患部位（項番94）" },
        "other_skin_disease_severity": { "type": "string", "description": "その他皮膚疾患程度 0:未選択,1:軽,2:中,3:重（項番95）" }
      }
    },
    "life_function": {
      "type": "object",
      "description": "生活機能とサービスに関する意見（項番96-122）",
      "properties": {
        "outdoor_walking": { "type": "string", "description": "屋外歩行 0:未選択,1:自立,2:介助があればしている,3:していない（項番96）" },
        "wheelchair_use": { "type": "string", "description": "車いすの使用 0:未選択,1:用いていない,2:主に自分で操作,3:主に他人が操作（項番97）" },
        "walking_aids": { "type": "string", "description": "歩行補助具・装具の使用 3桁のビットフラグ（項番98）" },
        "eating_behavior": { "type": "string", "description": "食事行為 0:未選択,1:自立ないし何とか自分で食べられる,2:全面介助（項番99）" },
        "current_nutrition_status": { "type": "string", "description": "現在の栄養状態 0:未選択,1:良好,2:不良（項番100）" },
        "nutrition_diet_notes": { "type": "string", "description": "栄養・食生活上の留意点（項番101）" },
        "possible_conditions": { "type": "string", "description": "発生可能性状態 14桁のビットフラグ（項番102）" },
        "other_condition_name": { "type": "string", "description": "その他の状態名（項番103）" },
        "response_policy": { "type": "string", "description": "対処方針内容（項番104）" },
        "life_function_improvement_outlook": { "type": "string", "description": "サービス利用による生活機能の維持・改善の見通し 0:未選択,1:期待できる,2:期待できない,3:不明（項番105）" },
        "medical_management_necessity": { "type": "string", "description": "医学的管理の必要性 11桁のビットフラグ（項番106）" },
        "other_medical_management": { "type": "string", "description": "その他の医学的管理（項番107）" },
        "service_blood_pressure": { "type": "string", "description": "サービス提供血圧 0:未選択,1:特になし,2:あり（項番108）" },
        "service_blood_pressure_notes": { "type": "string", "description": "サービス提供血圧留意事項（項番109）" },
        "service_eating": { "type": "string", "description": "サービス提供摂食 0:未選択,1:特になし,2:あり（項番110）" },
        "service_eating_notes": { "type": "string", "description": "サービス提供摂食留意事項（項番111）" },
        "service_swallowing": { "type": "string", "description": "サービス提供嚥下 0:未選択,1:特になし,2:あり（項番112）" },
        "service_swallowing_notes": { "type": "string", "description": "サービス提供嚥下留意事項（項番113）" },
        "service_mobility": { "type": "string", "description": "サービス提供移動 0:未選択,1:特になし,2:あり（項番114）" },
        "service_mobility_notes": { "type": "string", "description": "サービス提供移動留意事項（項番115）" },
        "service_exercise": { "type": "string", "description": "サービス提供運動 0:未選択,1:特になし,2:あり（項番116）" },
        "service_exercise_notes": { "type": "string", "description": "サービス提供運動留意事項（項番117）" },
        "service_other_notes": { "type": "string", "description": "サービス提供その他の留意事項（項番119）" },
        "infection": { "type": "string", "description": "感染症有無 0:未選択,1:有,2:無,3:不明（項番121）" },
        "infection_name": { "type": "string", "description": "感染症名（項番122）" }
      }
    },
    "special_notes": {
      "type": "object",
      "description": "特記すべき事項（項番123）",
      "properties": {
        "other_notes": { "type": "string", "description": "その他特記事項 700文字/12行以内（項番123）" }
      }
    }
  }
}
