{
  "basic_info": {
    "date_of_writing": "",
    "patient_name_kana": "",
    "patient_name": "",
    "birth_date": "",
    "age": "",
    "sex": "0",
    "postal_code": "",
    "address": "",
    "phone": "",
    "physician_name": "",
    "institution_name": "",
    "institution_postal_code": "",
    "institution_address": "",
    "institution_phone": "",
    "institution_fax": "",
    "consent": "1",
    "last_examination_date": "",
    "opinion_count": "1",
    "other_department_visit": "0"
  },
  "diagnosis": {
    "other_departments": "0000000000000",
    "other_department_names": "",
    "diagnosis_1_name": "",
    "diagnosis_1_onset": "",
    "diagnosis_2_name": "",
    "diagnosis_2_onset": "",
    "diagnosis_3_name": "",
    "diagnosis_3_onset": "",
    "symptom_stability": "0",
    "symptom_unstable_details": "",
    "course_and_treatment": ""
  },
  "special_medical_care": {
    "treatments": "000000000",
    "special_responses": "00",
    "incontinence_care": "0"
  },
  "mental_physical_state": {
    "bedridden_level": "0",
    "dementia_level": "0",
    "short_term_memory": "0",
    "cognitive_ability": "0",
    "communication_ability": "0",
    "peripheral_symptoms": "0",
    "peripheral_symptoms_details": "000000000000",
    "other_peripheral_symptoms": "",
    "psychiatric_symptoms": "0",
    "psychiatric_symptom_name": "",
    "specialist_visit": "0",
    "specialist_department": "",
    "dominant_hand": "0",
    "height": "",
    "weight": "",
    "weight_change": "0",
    "limb_loss": "0",
    "limb_loss_location": "",
    "paralysis": "0",
    "paralysis_right_upper_limb": "0",
    "paralysis_right_upper_limb_severity": "0",
    "paralysis_left_upper_limb": "0",
    "paralysis_left_upper_limb_severity": "0",
    "paralysis_right_lower_limb": "0",
    "paralysis_right_lower_limb_severity": "0",
    "paralysis_left_lower_limb": "0",
    "paralysis_left_lower_limb_severity": "0",
    "paralysis_other": "0",
    "paralysis_other_location": "",
    "paralysis_other_severity": "0",
    "muscle_weakness": "0",
    "muscle_weakness_location": "",
    "muscle_weakness_severity": "0",
    "joint_contracture": "0",
    "joint_contracture_location": "",
    "joint_contracture_severity": "0",
    "joint_pain": "0",
    "joint_pain_location": "",
    "joint_pain_severity": "0",
    "ataxia_involuntary_movement": "0",
    "ataxia_upper_limbs": "00",
    "ataxia_lower_limbs": "00",
    "trunk": "00",
    "pressure_ulcer": "0",
    "pressure_ulcer_location": "",
    "pressure_ulcer_severity": "0",
    "other_skin_disease": "0",
    "other_skin_disease_location": "",
    "other_skin_disease_severity": "0"
  },
  "life_function": {
    "outdoor_walking": "0",
    "wheelchair_use": "0",
    "walking_aids": "000",
    "eating_behavior": "0",
    "current_nutrition_status": "0",
    "nutrition_diet_notes": "",
    "possible_conditions": "00000000000000",
    "other_condition_name": "",
    "response_policy": "",
    "life_function_improvement_outlook": "0",
    "medical_management_necessity": "00000000000",
    "other_medical_management": "",
    "service_blood_pressure": "0",
    "service_blood_pressure_notes": "",
    "service_eating": "0",
    "service_eating_notes": "",
    "service_swallowing": "0",
    "service_swallowing_notes": "",
    "service_mobility": "0",
    "service_mobility_notes": "",
    "service_exercise": "0",
    "service_exercise_notes": "",
    "service_other_notes": "",
    "infection": "0",
    "infection_name": ""
  },
  "special_notes": {
    "other_notes": ""
  }
}
